rank	entry_id	cluster	distance	content
1	419	10	0.3243349194526672364	The original system recorded every detail of each log entry when retrieving them 
2	1	1	0.3441089391708374023	Switched spill from per-tool log files to a single SQLite database. Centralized  
3	418	10	0.3548831045627593995	The initial method of recording every detail of a retrieval was implemented by l 
4	391	10	0.3681687414646148681	The collection of log data should be consolidated into a single SQLite database, 
5	392	10	0.3752748966217041015	To consolidate all logging data, it’s proposed to store these records within a s 
6	393	10	0.3767853677272796631	To consolidate all log data into a single SQLite database, which is accessible b 
7	414	10	0.377017378807067871	The logging system employs text-based messages, rather than numerical codes. Spe 
8	123	1	0.378953486680984497	The process of transferring data from per-tool log files to a single SQLite data 
9	420	10	0.3796942234039306641	The initial process of recording every detail of each content item was extensive 
10	121	1	0.3836044669151306153	The process of transferring the log data from per-tool files to a single SQLite  
11	122	1	0.3950364291667938233	The process of managing log data shifted from separate per-tool files to a singl 
12	413	10	0.3985502719879150391	The messages produced by a logging system are typically structured as sentences, 
13	396	10	0.4027946293354034423	The system utilizes three distinct severity classifications: detail, alert, and  
14	395	10	0.4034491181373596191	The system utilizes three distinct warning classifications: info, warn, and erro 
15	144	1	0.4049526751041412354	The system meticulously formatted its log records as JSON data, rather than pres 
16	412	10	0.4060438871383666993	The system logs are structured as sentences, not numerical codes. Specifically,  
17	394	10	0.406307905912399292	The system utilizes three distinct severity classifications: detail, alert, and  
18	91	10	0.4078114628791809082	spill logs to a single SQLite database shared across all tools. Each log entry r 
19	143	1	0.4083510637283325196	The system meticulously formatted its log entries using JSON structures, replaci 
20	415	10	0.4097046852111816406	The process of analyzing crib logs details which pathways yielded data, but it d 
