rank	entry_id	cluster	rerank_score	rrf_score	channels	content
1	328	7	0.634000	0.027027	fts+vec	The structure of the repository is organized as follows: executables are stored  
2	51	6	0.000036	0.016129	vec	Open3.capture3 is the standard way to call external commands in Ruby when you ne 
3	305	7	0.000001	0.015152	vec	The `Commit` commands are designated by a prefix, typically followed by a colon: 
4	411	10	0.000000	0.029469	fts+vec	Database management involves a manual process of rotation.  If the database reac 
5	329	7	0.000000	0.027588	fts+vec	The design of the repository involves classifying files into distinct locations: 
6	90	9	0.000000	0.016393	vec	Posts follow a consistent structure: TL;DR, setup, experiment, results, dead end 
7	480	0	0.000000	0.016393	fts	The atmospheric circulation patterns in the Southern Hemisphere exhibit a system 
8	479	0	0.000000	0.016129	fts	The atmospheric patterns in the Southern Hemisphere trend in a specific directio 
9	70	7	0.000000	0.015873	vec	Repository layout: bin/ for executables, lib/ for shared code if any, memory/ fo 
10	478	0	0.000000	0.015873	fts	The atmospheric circulation patterns in the Southern Hemisphere follow a particu 
