rank	entry_id	cluster	rerank_score	rrf_score	channels	content
1	67	7	0.999949	0.015625	vec	Rebasing is preferred over merge commits for keeping history linear. Interactive 
2	319	7	0.999897	0.029462	fts+vec	Merging commits is generally considered a more appropriate approach for maintain 
3	397	10	0.992771	0.015385	fts	The records generated within the system are organized by the tool name as a desi 
4	399	10	0.376039	0.015873	fts	The records generated by the system detail the tool’s name as a distinct element 
5	395	10	0.062182	0.014925	fts	The system utilizes three distinct warning classifications: info, warn, and erro 
6	396	10	0.011268	0.02904	fts+vec	The system utilizes three distinct severity classifications: detail, alert, and  
7	302	7	0.002636	0.014925	vec	Here’s a rewritten version of the text, maintaining the original meaning:  The core of each development tool’s repository features a consistent, unified ma 
8	304	7	0.000856	0.016393	vec	The commit messages are assigned a unique identifier, typically starting with "t 
9	413	10	0.000703	0.016129	fts	The messages produced by a logging system are typically structured as sentences, 
10	326	7	0.000097	0.02885	fts+vec	Due to the presence of a single developer, initiating a merge to the main branch 
11	414	10	0.000002	0.016393	fts	The logging system employs text-based messages, rather than numerical codes. Spe 
12	327	7	0.000000	0.029274	fts+vec	The immediate shift to the primary branch is a permissible course of action, giv 
13	325	7	0.000000	0.026671	fts+vec	Due to the presence of a single developer, initiating a force-push to the main b 
14	315	7	0.000000	0.025978	fts+vec	Version control systems utilize git tags primarily for identifying specific rele 
15	303	7	0.000000	0.015873	vec	The development of each tool involves a single, foundational branch that serves  
16	398	10	0.000000	0.015625	fts	The records generated contain a tool identifier, presented as a defined element  
17	301	7	0.000000	0.014706	vec	The core repositories for each tool contain a single, foundational branch, elimi 
18	394	10	0.000000	0.014706	fts	The system utilizes three distinct severity classifications: detail, alert, and  
19	148	1	0.000000	0.014493	vec	The current architecture does not employ a message bus. Communication between co 
20	393	10	0.000000	0.014493	fts	To consolidate all log data into a single SQLite database, which is accessible b 
