rank	entry_id	cluster	rerank_score	rrf_score	channels	content
1	392	10	0.999773	0.015385	vec	To consolidate all logging data, it’s proposed to store these records within a s 
2	91	10	0.999388	0.016393	vec	spill logs to a single SQLite database shared across all tools. Each log entry r 
3	1	1	0.994890	0.015873	vec	Switched spill from per-tool log files to a single SQLite database. Centralized  
4	396	10	0.656518	0.015625	vec	The system utilizes three distinct severity classifications: detail, alert, and  
5	391	10	0.012597	0.015152	vec	The collection of log data should be consolidated into a single SQLite database, 
6	393	10	0.000002	0.016129	vec	To consolidate all log data into a single SQLite database, which is accessible b 
7	420	10	0.000000	0.028039	fts+vec	The initial process of recording every detail of each content item was extensive 
8	418	10	0.000000	0.027273	fts+vec	The initial method of recording every detail of a retrieval was implemented by l 
9	414	10	0.000000	0.026172	fts+vec	The logging system employs text-based messages, rather than numerical codes. Spe 
10	463	0	0.000000	0.016393	fts	The Atacama Desert, located in Chile, stands as the most arid region on the plan 
11	462	0	0.000000	0.016129	fts	The atmospheric pressure is fluctuating significantly, exceeding 24 millibars, o 
12	460	0	0.000000	0.015873	fts	The atmospheric pressure levels will decrease by more than 24 millibars over a p 
13	458	0	0.000000	0.015625	fts	In the year 2023, the Rugby World Cup held in France experienced unprecedented v 
14	456	0	0.000000	0.015385	fts	The protein composition of bread flour is notably greater than all-purpose flour 
15	455	0	0.000000	0.015152	fts	Wheat flour exhibits a greater concentration of protein compared to standard all 
16	434	0	0.000000	0.014925	fts	The positioning of the jet stream has a significant impact on the severity of wi 
17	121	1	0.000000	0.014925	vec	The process of transferring the log data from per-tool files to a single SQLite  
18	123	1	0.000000	0.014706	vec	The process of transferring data from per-tool log files to a single SQLite data 
19	122	1	0.000000	0.014493	vec	The process of managing log data shifted from separate per-tool files to a singl 
20	419	10	0.000000	0.014493	fts	The original system recorded every detail of each log entry when retrieving them 
