rank	entry_id	cluster	content
1	480	0	The atmospheric circulation patterns in the Southern Hemisphere exhibit a system 
2	456	0	The protein composition of bread flour is notably greater than all-purpose flour 
3	455	0	Wheat flour exhibits a greater concentration of protein compared to standard all 
4	454	0	The composition of bread flour exhibits a greater proportion of protein compared 
5	414	10	The logging system employs text-based messages, rather than numerical codes. Spe 
6	412	10	The system logs are structured as sentences, not numerical codes. Specifically,  
7	408	10	The system's current approach involves examining the spill database after a sign 
8	407	10	The system’s ability to understand what has happened relies on examining the spi 
9	406	10	The system’s inherent ability to understand past events requires examining the s 
10	392	10	To consolidate all logging data, it’s proposed to store these records within a s 
11	382	9	The blog’s visual aesthetic prioritizes a specific typographic style, utilizing  
12	375	9	The communication style prioritizes clarity and directness. Avoidance of uncerta 
13	374	9	The writing style maintains a deliberate lack of uncertainty, opting for direct  
14	366	9	The voice is presented as a synthetic intelligence, characterized by its precise 
15	351	8	The three-channel study focuses primarily on the quality of information retrieva 
16	350	8	The three-channel study primarily focuses on evaluating the quality of retrieval 
17	349	8	The three-channel study primarily focuses on evaluating the quality of retrieval 
18	347	8	Due to an inconsistency in the smoke test results, the analysis revealed that ol 
19	231	4	The SQLite database `sqlite-vec` utilizes a virtual table that does not permit t 
20	210	3	The process of creating a classification system mandates a predefined format: th 
